{
  "schema_version": "1.0",
  "image": {
    "width": 4032,
    "height": 3024,
    "exif": {
      "iso": 800,
      "exposure_time_s": 0.0333,
      "f_number": 1.8,
      "focal_length_35mm": 24,
      "exposure_bias_ev": 0.0,
      "white_balance_mode": "auto",
      "device_model": "iPhone 16 Pro"
    }
  },
  "skip_reason": null,
  "scene": [
    "portrait",
    "indoor"
  ],
  "scores": {
    "exposure": 100,
    "composition": 100,
    "color": 100,
    "sharpness": 100,
    "overall": 100
  },
  "issues": [],
  "suggestions": [],
  "overlays": {
    "saliency_bbox": [
      0.31,
      0.42,
      0.18,
      0.31
    ],
    "saliency_grid": [
      [
        0.0,
        0.0,
        0.0,
        0.0,
        0.0,
        0.0,
        0.0,
        0.0,
        0.0,
        0.0,
        0.0,
        0.0,
        0.0,
        0.0,
        0.0,
        0.0
      ],
      [
        0.0,
        0.0,
        0.0,
        0.0,
        0.0,
        0.0,
        0.0,
        0.0,
        0.0,
        0.0,
        0.0,
        0.0,
        0.0,
        0.0,
        0.0,
        0.0
      ],
      [
        0.0,
        0.0,
        0.0,
        0.0,
        0.0,
        0.0,
        0.0,
        0.0,
        0.0,
        0.0,
        0.0,
        0.0,
        0.0,
        0.0,
        0.0,
        0.0
      ],
      [
        0.0,
        0.0,
        0.0,
        0.0,
        0.0,
        0.0,
        0.0,
        0.0,
        0.0,
        0.0,
        0.0,
        0.0,
        0.0,
        0.0,
        0.0,
        0.0
      ],
      [
        0.0,
        0.0,
        0.0,
        0.0,
        0.0,
        0.0,
        0.0,
        0.0,
        0.0,
        0.0,
        0.0,
        0.0,
        0.0,
        0.0,
        0.0,
        0.0
      ],
      [
        0.0,
        0.0,
        0.0,
        0.0,
        0.0,
        0.07,
        0.09,
        0.05,
        0.0,
        0.0,
        0.0,
        0.0,
        0.0,
        0.0,
        0.0,
        0.0
      ],
      [
        0.0,
        0.0,
        0.0,
        0.02,
        0.19,
        0.31,
        0.34,
        0.29,
        0.16,
        0.0,
        0.0,
        0.0,
        0.0,
        0.0,
        0.0,
        0.0
      ],
      [
        0.0,
        0.0,
        0.0,
        0.17,
        0.38,
        0.54,
        0.59,
        0.51,
        0.34,
        0.13,
        0.0,
        0.0,
        0.0,
        0.0,
        0.0,
        0.0
      ],
      [
        0.0,
        0.0,
        0.01,
        0.26,
        0.5,
        0.73,
        0.84,
        0.68,
        0.45,
        0.21,
        0.0,
        0.0,
        0.0,
        0.0,
        0.0,
        0.0
      ],
      [
        0.0,
        0.0,
        0.02,
        0.27,
        0.52,
        0.76,
        0.9,
        0.71,
        0.47,
        0.22,
        0.0,
        0.0,
        0.0,
        0.0,
        0.0,
        0.0
      ],
      [
        0.0,
        0.0,
        0.0,
        0.2,
        0.41,
        0.59,
        0.65,
        0.56,
        0.37,
        0.15,
        0.0,
        0.0,
        0.0,
        0.0,
        0.0,
        0.0
      ],
      [
        0.0,
        0.0,
        0.0,
        0.06,
        0.24,
        0.36,
        0.4,
        0.34,
        0.21,
        0.02,
        0.0,
        0.0,
        0.0,
        0.0,
        0.0,
        0.0
      ],
      [
        0.0,
        0.0,
        0.0,
        0.0,
        0.03,
        0.13,
        0.15,
        0.11,
        0.01,
        0.0,
        0.0,
        0.0,
        0.0,
        0.0,
        0.0,
        0.0
      ],
      [
        0.0,
        0.0,
        0.0,
        0.0,
        0.0,
        0.0,
        0.0,
        0.0,
        0.0,
        0.0,
        0.0,
        0.0,
        0.0,
        0.0,
        0.0,
        0.0
      ],
      [
        0.0,
        0.0,
        0.0,
        0.0,
        0.0,
        0.0,
        0.0,
        0.0,
        0.0,
        0.0,
        0.0,
        0.0,
        0.0,
        0.0,
        0.0,
        0.0
      ],
      [
        0.0,
        0.0,
        0.0,
        0.0,
        0.0,
        0.0,
        0.0,
        0.0,
        0.0,
        0.0,
        0.0,
        0.0,
        0.0,
        0.0,
        0.0,
        0.0
      ]
    ],
    "faces": [
      [
        0.38,
        0.2,
        0.2,
        0.26
      ]
    ],
    "horizon_angle_deg": null,
    "horizon_conf": 0.05,
    "suggested_crop": null
  },
  "timings_ms": {
    "s0": 8,
    "s1": 42,
    "s2": 31,
    "s3": 58,
    "s4": 1,
    "s5": 0
  },
  "runtime": {
    "platform": "ios",
    "onnx_ep": "coreml",
    "llama_backend": "metal",
    "core_version": "0.1.0"
  },
  "generator": "template"
}
